judul,isi
Kualitas Jagung RI Dinilai Tak Kalah Saing dengan Produk Impor,
Capaian Kementan Terkait Produksi Jagung Diapresiasi,
"Argentina Mau Ekspor Jagung ke RI, Mentan: Kita Sudah Swasembada",
Harga Jagung RI Lebih Mahal dari Brasil Gara-gara Kekeringan,
"Panen Jagung Diprediksi Oktober, Pemerintah Diharapkan Tak Impor",
"Tahun Baru Datang, Pedagang Jagung Senang",
"RI Ekspor Jagung hingga Ubi ke 29 Negara, Ini Daftarnya",
"Tumpangsari Jadi Andalan Genjot Produksi Padi, Jagung & Kedelai",
"Mentan Sebut Produksi Jagung Aman, RI Tak Perlu Impor",
Keren! Bulir Jagung Unik Ini Warna-warni Seperti Pelangi,
Jangan Terkecoh! 12 Sayuran Ini Sebenarnya Adalah Buah,
"Jagung Tergolong Jenis Buah, Sayur atau Bijian Ya?",
link,judul,isi
,,
